Company,ReviewID,Rating,Review_Text
King Soopers,1elgoaakcu2j4800,4.0,"I had very good relationship with managers, they were responsive, accommodating, and supportive. The over all environment was not the best, but it was a great temporary job."
King Soopers,1f7pupln4u28m800,2.0,"Working in the front end can be pretty hectic, we are usally always unstaffed and the headclerks that run the front end are good but the upper management in this store is poor and they dont care about any of the employees they hire."
King Soopers,1f7elgri4u26j800,4.0,There is a clear separation between part time and full time workers. Which can be either a good thing or a bad thing depending on how you look at it. My only piece of advice is to strongly voice your opinion to HR or management otherwise they will not notice you or respect you.
King Soopers,1f7cfqkjju2ud800,4.0,"For people looking for a basic summer job. This is great. If you want a career, there are opportunities. You start at minimum wage. But you get regular pay increases. Full benefits are available. There are a lot of long term dedicated employees who have superiority complexes. Management is a little too micromanaging. The stores are always understaffed so you’re constantly bouncing around departments."
King Soopers,1f78o1mbhu2ud800,1.0,"I wouldn't recommend them to my worst enemy. The upper management sit upstairs all day as they cut everyone's hours and demand no over time, yet your in charge of doing 3 peoples jobs. If you don't get that much work done, they wrote you up because couldn't finish all the work."
King Soopers,1f724tqmahijp800,1.0,Want to work multiple jobs for terrible wages? Do you want a job where there are no opportunities to advance? Do you like your coworkers talking about you behind your back? Do you like the underside of your bosses boots? Are you a masochist? Work at King Soopers.
King Soopers,1f71c0sua3obs000,2.0,"It's a corporation, it will chew you up and spit you out. It was ok until I got promoted to full time. I was forced to give up almost all off days and even then it was never enough. Worked sick, exhausted and stressed out and not one person in upper management gave a care, they just expected more."
King Soopers,1f6qhnj6h3obs000,2.0,"I was training to become a manager and went above and beyond for 2 years when a new front end supervisor transferred to my store and brought an entire new front end management staff. Instead of getting the promotion I was promised, the new manager gave my position away to a friend of theirs that had transferred to our store. This person was promoted with no formal training or effort. I had undergone countless hours of training and even had to travel to other cities to take management classes, but I was pushed aside and given no explanation. If you aren't friends with the managers, you will not advance."
King Soopers,1f6o4u2p7hijp800,2.0,"Not necessarily a hard job, or a bad place to work. Management is fine generally, but of course your manager is just the first in a endless bureaucratic chain, so getting real ideas for change to people that can implement it is difficult. Like any retail job the simultaneously best and worst part is the customers. And since its a grocery store a very wide net of people gets cast. This job definitely has made me appreciate jobs I have had at more mom and pop type companies because there is just a better cohesion and focus of quality work culture."
King Soopers,1f6fqhc7r3ocs000,3.0,"King Soopers is a work focused environment at all times. They will start you off on your main job but will ask you to learn other departments. Covering another department became a typical thing. Not everyday, but often enough. The very top management were great and understanding, while the more day to day management were strict and callous. The hardest part of the job was working both a night shift and a day shift in a row. Happened a few times which got me physically ill at one point. What was enjoyable about the job was how clear what you needed to do. The simplification of what needs to be done was the only enjoyable part of it."
King Soopers,1f5tnneiuu3af800,2.0,"I recently turned in my notice after working only 1 week. I sensed the ""who cares about you and your life"" attitude straight away. I was mislead during my interview process, so I quit. I am 46 yo and past the point of his school fuckery. I would not recommend working for this company unless you enjoy being exploited. You will soon fall into the culture of ""well, since my employer doesn't care for my wellbeing,  I don't care either"". It's an extremely disconcerting situation. The kicker is, I really enjoyed my actual job, the ""real"" position I agreed to upon hiring. In short, don't waste your time."
King Soopers,1f5tboo9hu4lu800,1.0,Depending on your store management sucks. They don't care about you or your life. Call you in everyday you have off. Pay is little to nothing for what you have to do. Lowest paying grocery store as well.
King Soopers,1f5rvrlipsaai800,3.0,Good pay once you top out.
King Soopers,1f5lpu2tvu4lu800,3.0,"I worked in several departments at King Soopers, e-commerce, front end, and floral."
King Soopers,1f5jnb69mu2n1800,4.0,Good job that has a good environment to work in. The coworkers are great and make it a family atmosphere. The pay was good and so were the benefits. Overall nice place to work.
King Soopers,1f5j3e8ddu3af800,3.0,Customers are ungrateful. It doesn’t matter what you do it’s never enough. It’s frustrating. The beat part of working there is the friends you meet on the job.
King Soopers,1f59pu710u2n1800,1.0,"Very physical during the summer. Management does not cater to flexible schedules (i.e. if you have a commitment every week like church, they will not help you to make your schedule not conflict with that). Poor training."
King Soopers,1f59hqof8u3af800,2.0,Negative work environment the older people don’t want younger people to be in management because they don’t want younger people telling them what to do. Management does not care or want to help you with anything. And if you get promoted you are thrown to the wolves and will not get the help you seek. The old people go against the younger generation and the younger generation isn’t paid enough to work harder then the older generation. Bad company
King Soopers,1f56f9t93saai800,2.0,"Management was awful. was unfairly demoted. Was lied to about accommodations and told ""oh well"". This place is only worth it if you can stick it out for 10 plus years."
King Soopers,1f568dnv6u2n1800,1.0,"You wanna be treated terribly on the daily?Then boy I have the place for you! Not only will customers walk all over you, but management treats you like youre dumb, even though you most likely know the job better than they do! And you're supposed to take it! We are constantly overworked, understaffed, and underpaid. This company just keeps getting worse and worse in the years I've wasted here and they keep adding more for you to do while slashing hours every where they can, making it impossible to finish your job. Then they yell at you for not being good enough. This place can barely call itself a job, maybe a good place holder while you look for a new job. Please. Don't work here."
King Soopers,1f51g7cicu3af800,3.0,"Continually cutting tech hours despite large workload and always asking staff to do more.  This is pretty typical of retail pharmacy though.  Pay and benefits are great, especially for managers."
King Soopers,1elgoaakcu2j4800,4.0,"I had very good relationship with managers, they were responsive, accommodating, and supportive. The over all environment was not the best, but it was a great temporary job."
King Soopers,1f4j1kvv2u392800,4.0,Decent company and can place you in various roles is your current doesn't suite you. Great place for college or younger age students to work because of flexibility.
King Soopers,1f4f4o3c1u39f800,1.0,The pay is the only thing keeping me here...
King Soopers,1f3s80c7ou1vt800,2.0,I’ve worked at 2 different stores. First one felt close knit and fun. Second one felt hollow and soulless.
King Soopers,1f3jm3868u3dj800,4.0,King soopers is a good place to work at in all honesty. Not too difficult as long as you're okay with social situations because you do need to talk to a lot of people. Your work will be what you make it. As long as you keep your head on right you'll be fine. The pay could be better and management does their best.
King Soopers,1f3ik5nn3u3dj800,2.0,Never worked in such a negative and hostile environment before. Management honestly does not care about employees. Associates are constantly threatened with transfer/termination for simply not being able to work overtime. People are told that their responsibilities as a parent are not a valid excuse to leave when scheduled to get off.
King Soopers,1f35cv5ib3ki8000,3.0,Amazing.....great company. Good reputation.......pay can be better. Over all it's pretty incredible... So far.....fingers crossed ..... Good times!!!!!-
King Soopers,1f2pdsia6u1v3800,4.0,"I love the location,  and the work I do here.  However the expectation aren't within reach of any individual that is having health issues or simply aging. They have unreasonable expectations of their night crew and not enough for their day crew.  While I struggle to make cases per hour at 45yrs old the recieving crew and department managers smoke out front or in the back of the building every 20-30 minutes.  They also play favorites within departments and promote the person who talks and not the person working their butt off. This company has absolutely no loyalty values...."
King Soopers,1f2a2lie9him2800,3.0,It is fast paced and can be challenging in some areas. Overall being able to great customers is the best part. I am able to make sure the customer gets what is asked and make sure they’re satisfied.
King Soopers,1f21s4njdu1v3800,2.0,"If you are an hourly employee, they want to incur no overtime, which makes sense but also makes it difficult to make a living."
King Soopers,1f1v8ta89u3hv800,2.0,It’s a minimum wage job so you’re worked like a dog for little pay. Not allowed to accept any sort of tip for walking out groceries or anything like that. The parties are nice but it’s rare.
King Soopers,1f1lfu0r9u3hv800,1.0,"Truth be told it varies between and among different stores, my home store was fine, i got along with my crew and managers, but at my current store the management in my department needs some serious work. The store in and of itself needs work."
King Soopers,1f1ipq7niu40q800,3.0,"Easy job to learn and do, like most entry level positions. The job gets repetitive pretty quickly though because you're just going around picking up groceries for people for the majority of your shift. Most of the coworkers are easy to get along with, but they are also mostly just kids or new hires."
King Soopers,1f1ikfn3ou3hv800,3.0,Great company if you're looking to rise fast. They reward intelligence and obedience.
King Soopers,1f0h5tb7un54g800,1.0,This place is a joke and the union isn't much better. The culture is toxic and promotes a cult like atmosphere of fear and control. There are much better places to invest your time and energy.
King Soopers,1evtnlib7u1sg800,5.0,Was a great job. Job stability. Room for advancement. Highly stressful most times but doable. Will move you to other stores without your permission.....
King Soopers,1evt05320n52h800,3.0,"King Soopers isn't for everyone. Front end requires good customer service skills including patience and understanding. Grocery requires being able to work effectively without supervision. The pay isn't great if you don't already have experience, and the time worked promotions are small and infrequent. It's a good first job, but it's not a career unless you become management or are willing to become a certified pharmacy tech."
King Soopers,1evr5gmun26a4000,2.0,Typical retail pharmacy.  I guess it's not any better or worse than any other retail pharmacy these days.  When I started there it was great with lunch breaks and 8 hour shifts.  Those are in the past though
King Soopers,1evd03l2l26ak000,2.0,"I don't know where to start with this company. The time clock is finnicky and rarely lets you clock in properly, management is passive-aggressive and difficult to work with, and schedules are released last minute most of the time. Although I was offered a full-time position, I later realized I was lied to and given a part-time position."
King Soopers,1evcpqk0jn55l800,3.0,Basic retail job. There is lots of turnover so you will be working with new people regularly.  Managers don't last long so don't get too comfortable with them.
King Soopers,1ev9btc9j26ak000,5.0,"There is always people going in and out of kingsooper, so there is.alot of customer service. There was always amazing people to work with. I always enjoyed going to work"
King Soopers,1elgoaakcu2j4800,4.0,"I had very good relationship with managers, they were responsive, accommodating, and supportive. The over all environment was not the best, but it was a great temporary job."
King Soopers,1ev5qtuu226ak000,3.0,"I am in e-commerce. I shopped one round with someone who had only been there a month, and then I was left on my own. Most things I learned after the first hour I learned by getting reprimanded for not doing it “right”. Everything else, I either asked to be taught or just paid very good attention. Thanks for the training “management”."
King Soopers,1euvt344u26ak000,1.0,"Where to begin. King Soopers, in their hiring add boast of great benefits,  excellent training program, flexible hours. This is as far from the truth as is possible. There is no training program whatsoever, the less than average benefits packages are way below standard for a company of King Soopers massive size and you can't get time off to take care of your health concearns anyways. The hours n schedules are never ever flexible. Another drawback is that King Soopers only hires part time and will do everything they can I believe to keep employees at a part time basis as to avoid paying health benefits and or at a higher full time rate. Part time people I have experienced had a minimum of 3 years, and some over 5 years at part time level wanting and applying for full time at every opportunity. Management are unfriendly and care about only one thing n that's BONUSES riding the backs of their employees more often than not leaving them short handed, over worked, and underpaid."
King Soopers,1euvpbidi26ak000,5.0,The King Soopers family is an excellent place to work the people are great the customers are great everything about the job is fantastic to me however at 47 years old I am unable to support myself and live in my own apartment which is kind of a requirement that I have it’s a great place and I would really love to stay there but financially I am unable to do so
King Soopers,1euud4tg5n55l800,5.0,A pretty good place to work overall. Really enjoyed my job! Worked there for ten years and i had alot of good experiences. Weekly pay also. Short staffed alot but you work thru it
King Soopers,1eur2q26tu1ib800,1.0,Management sucks and does not listen to any type of concerns.
King Soopers,1euq5r83ou1ki800,1.0,This company is terrible and only about profit. Your a number to them. They don't care about you or your wellbeing. Look for a job elsewhere. Don't fall victim to this company.
King Soopers,1euni6cicu1ki800,1.0,Dont do it. Go to Safeway their much better and nicer. Kings has to much side stuff going on between upper management and corporate and so on and so on. Cover up's its no good. Don't waste your time. It'll only make you crazy.
King Soopers,1eueuenuqu1ib800,3.0,"Used to be a good place to work. Not hard to move up the ladder. Pay is ok. Department Manager not paid much more than a senior clerk. Best part of the job is getting to work with great people. Management has stupid expectations that change constantly, customers destroy your hard work in a matter of minutes when it’s busy, which is to be expected. Management gets upset when everything isn’t perfect and full at all times, which isn’t realistic. Big wigs come in and nitpick everything constantly, kind of comical with the stuff they complain about. Tough choice to leave at the time but I had enough and I couldn’t be happier now. Overall not a terrible place but there is better out there."
King Soopers,1eu6rd7oou1ki800,3.0,"They're pretty straightforward about what your job is like from the beginning. The different departments are all pretty supportive teams but there's a lot of drama between the departments and it can sometimes be started by upper management. Upper management doesn't really help much and can be verbally abusive towards their department managers and assistant store managers. Then they'll be extra nice to entry level employees, which leaves everyone feeling awkward at best. The work is tough but if you need to go easy on yourself every now and then they're pretty understanding of that. Don't expect raises. When you're hired they'll tell you you'll get raises but don't hold your breath for them. Every few months they'll put $100 on your employee card and say they appreciate you. They appreciate you enough to give you money that goes right back to the company. Overall the work environment is a positive one but that's because of the other employees so it could change depending on who's still around after X number of months."
King Soopers,1eu6je484u1ki800,1.0,"This is the job if you want to be overworked and underpaid. Upper management will change your schedule without telling you, and get mad if you don’t show up the shift they don’t tell you about it. not even close to good pay, only benefits after a year. People are constantly getting hiring then quitting or walking out with no notice. District only cares about the numbers and putting more work on you but cut your hours so they can get bonuses. Not even close to the right pay for the labor of it. walking for 8 1/2 hours and pushing a at least 300 lbs trolley full of groceries and lifting totes full of milk and cans. Customers also hate you."
King Soopers,1eu50mnlpn5b4800,4.0,Have to know what isle every individual item goes on and be able to unload a trailer and get most everything  put away before costumers start coming in to shop everyone is super friendly
King Soopers,1etcheeufu1n1800,3.0,Apply if you can the money is great and the job is not hard at all people are awesome and the days go by fast because you are so busy and you get two paid breaks and one un paid lunch
King Soopers,1esutaqk4u1n1800,1.0,"There was nothing good about working here. Upper management was unfair to all employees a lot of the time, when they themselves did nothing of importance in the store. Doesn't matter how bad you need the money, working there is prison"
King Soopers,1esmg9kduu3cn800,2.0,Hired as part time but then given full time schedule with no access to any benefits since I was officially only part time.  Then i was told another person was coming back and I would have to interview for another position.  Low low employee morale. Gave 2 weeks notice but wasn't taken seriously. Thankfully I spoke with 2 managers who remembered my giving notice.
King Soopers,1esjdb7beu31u800,1.0,"For the amount of time spent and the labor put into each shift, your efforts are barely ever recognised and I felt inferior to/ lesser than all management. The job itself was pretty simple and straightforward, but was definitely made difficult when there were only three people opening in the mornings and seemingly no cap on hourly orders.  Meaning we would have to rush to get as much done as possible without any help. Worked 12 hours straight quite a few shifts with no breaks or lunch because we had to catch up. Coworkers were nice, management definitely chose favorites."
King Soopers,1esir7hlcu3cn800,5.0,Great place to work and build a career. Flexible with schedule. Assistance with education and the ability to move up in company. I would recommend this place to anyone.
King Soopers,1esiftmjbu3cn800,3.0,"Study paycheck it is an essential job. Get to know a lot of people since you are working with the public. They need to value their employees more and do not have their favorites. , it is not fair to others."
King Soopers,1es745qo3u418800,1.0,They don’t care about the lives of their employees. They will knowingly let you contract covid and then still make you work. They will do whatever they need to do to make a dollar. This job was terrible before covid but is just straight up dangerous now.
King Soopers,1es73vd8c3ogl000,3.0,"I think that if I went for an administrative position I would’ve had a more fulfilling experience all around. Most people I met were treated fairly with few exceptions, excluding new employees in entry level positions. In the short time I worked I noticed a remarkably high turnover rate; it seems that the concepts of “seniority” and “loyalty” were terms used to articulate the clandestine hegemony the company represents. It was relatively comfortable, reasonable break times, etc; but occasionally dehumanizing and despondent. The typical “company presenting itself as a facsimile of family”."
King Soopers,1es3flktt3ogl000,1.0,The store I worked at was a high volume store so management did care how they treat staff or customers. Don't recommend king soopers at all working there or being a customer
King Soopers,1elgoaakcu2j4800,4.0,"I had very good relationship with managers, they were responsive, accommodating, and supportive. The over all environment was not the best, but it was a great temporary job."
King Soopers,1erp6nqkmu1sr800,4.0,Retail is not for the weak hearted. Sometimes customers are moody.
King Soopers,1erer5cbcu49m800,2.0,"I loved all my coworkers. They were all so sweet and friendly, it was everything else that drove me away. I did a lot. I was doing three departments, and three peoples' jobs for minimum wage. I was there for over a year and my pay raises weren't enough to cover rent, let alone food and other expenses. I was stressing myself to sickness, a lot. Not to mention my mental conditions were amplified so I'd leave work in tears a lot too. I liked the busy work and fast pace environment, but it got to be too much. Especially with Covid-19 running rampant."
King Soopers,1eqqo9d5ssa99800,4.0,"I have used KS several times throughout the years for a job.  I cannot say I enjoyed working there but it was a decent job.  I worked in many different positions within the store and they all have their strengths and weaknesses.  It can be a career and some people I have known are able to live off the income, I never was.  One of my daughters dropped out of school and she got a job there and I thought it was a great decision. If you do not have the desire to continue your education, grocery management is not a bad place to work.  You get retirement, health benefits, and a decent wage if you do get into entry-level management."
King Soopers,1eqo7ft6bu49m800,4.0,The employees are probably the highlight. Management varies by stores I’ve had awesome store managers that actually care for you. Or not so great but the work isn’t super hard. The pay is good if you’re in management or been there long enough. Union job so that is a plus with job security. It’s not the worst out there.
King Soopers,1eqkl7su2u35m800,1.0,"King Soopers doesn't care. Even the good managers start not caring after they see its not going to get them any further if they care. It's ""all about the team"" when 1 or 2 people do all the work and don't get paid or the credit they deserve. I'd rather be broke than work for somewhere that doesn't even pay more than $13/hr for almost 2 years of working and being one of the hardest workers in multiple departments that I'm put in. Honestly, if you want to work somewhere stressful that doesn't pay enough and still criticizes you for doing more than your managers do, take the job. No one at my store wanted to be there everyday and would drink just to come back to work the following day"
King Soopers,1eqglhtcau35m800,5.0,It was a fun place to work at I do miss work there. I had to move away to Longmont so I could stay there. It would have made no sense to work in Fort Collins live in Longmont
King Soopers,1eq9ua935u49m800,5.0,The work is the same day in day out but the time goes quickly. The starting pay isn’t great but it goes up with time. It is a union job so raises are almost automatic
King Soopers,1eq9rl2ivu35m800,3.0,"It was an okay experience, thankful for the work family I had to make it that much better. I can not imagine how much more difficult it would be without them."
King Soopers,1eps0b6aqu35m800,1.0,Treated employees Poorly that didn't kiss up to management. Deli manager was not qualified to manage a dog kennel yet alone an entire department of a major grocer
King Soopers,1epgtopenu38g800,4.0,Its a good company if you find the right store to work for I say invest in the union other wise your job security won't be around much longer! If you put your nose to the grind and work hard you'll get far in the company
King Soopers,1ep7ij24eu32a800,3.0,"I worked at King Sooper twice and would probably work there again, However, I want a career in my life now and not just a after school job.  King Sooper has a high turn over rate because they treat their employees as ""replaceable"". NO Matter how hard you work or how good of a job you do, This leads to a lot of unfair work load on all employees, especially now during Covid-19."
