Company,ReviewID,Rating,Review_Text
King Soopers,1c6lu9t35aqj2dpv,3.0,"I worked at King Soopers for about a month before my fiancé, who worked at the same King Soopers, passed away. At first, I was not given bereavement until I came in twice to tell them it was necessary. I was placed on an LOA, then let go without notice due to said LOA."
King Soopers,1c6j8iojcak76ase,1.0,"King Soopers makes it sound like it would be a great job, and every one is super nice to you for the first day or two. But after you have been there more than a week they treat you like garbage and they are completely disrespectful."
King Soopers,1c6dtrobkakerdle,1.0,"No room for advancement, they play favorites, if you do get the chance to move up- you'll be moved to a new store every few months. Terrible pay, managers don't do anything but berate and harass you about store conditions you can't control."
King Soopers,1c6b9mp3bak6nbcg,4.0,"It's not great, its not terrible. Its a good job to have until you find what you're looking for. The immediate managers are nice but often over worked. The company is trying to hard to be an 'upscale Walmart'. They don't let you put any personal input really to improve the company. They just want to stream line everything. Only way to really move up is to become a manager, and nobody wants the positions cause they get poorly trained and over worked. Have fun getting the days off you want/need even if it's a putzy minor holiday."
King Soopers,1c687n1fjakei9he,4.0,I really enjoyed working for King Soopers. At my store I felt that they were fairly flexible with my schedule. Managers were driven to train their people in their teams and set goals. I liked that I felt I could improve but not felt talked down to.
King Soopers,1c65qotdfakifbgo,3.0,its just like any other grocery store but customer service is what brings people back. always have a smile on ya face and you will be fine. good work environment
King Soopers,1c62r7qfeak6nepe,4.0,"As fun and as challenging as it was, I never really felt that I belonged in the Deli Department. The management was awesome but my gut feeling told me to transfer over to Meat and Seafood because the managers over in that department were more challenging (in a good way) to work with. Their expectations were always high and I really wanted to challenge myself. Deli was challenging but I didn't feel as pushed by the managers"
King Soopers,1c61jph4raqii86e,4.0,It was a massive thing to see how everything made customers enjoy our new products and having to try them as we needed to. It made me realize that working in a small place actually had benefits that I never knew beforehand
King Soopers,1c60u2okpaqiif8e,4.0,"I worked at 4 am every day, so my day started early. I learned nothing. Management was't bad. The hardest part of the job were the people. The most enjoyable was always having something to do."
King Soopers,1c60pqu6pakau8ub,4.0,Very good staff that ensured I was educated in my duties and responsibilities so that I could succeed in the fast paced environment in the pharmacy. Great place.
King Soopers,1c60pag4caqii8lr,4.0,The pharmacy was well run. The pharmacy staff was nice and accommodating. They took the time to teach the important information while not hand holding at the same time.
King Soopers,1c5rv42nj5naid0b,4.0,Set up the meat amd seafood case put fresh product and sell with a friendly smile. At night put all product away and cleaned both cases made sure nothing was dirty.
King Soopers,1c5rfsjg1akif923,3.0,This is an entry level position. It was where I learned how to manage people and situations. This position I learned the accounting side of King Sooners. Customer service and associate service.
King Soopers,1c5rf4jddakiff41,3.0,"Manage the store in absence of Store Manager. Maintain breaks and lunches. Guest relations, solving issues. Discipline and coaching new and seasoned associates. Responsible for the cash and media of the store. Rolled out many new programs."
King Soopers,1c5r9a3v7akifa5e,4.0,Working at King Soopers was a lot of fun but came with a lot of work to do throughout that day. Had to be quick with customers but also work with them in a timely manner. Management could have been a little stronger in certain areas but some how made things work.
King Soopers,1c5lu0pbnaki7882,2.0,not fun at all because of the environment and there has been unsafe activities happening there and i dont reccomend working there because of their past history
King Soopers,1elgoaakcu2j4800,4.0,"I had very good relationship with managers, they were responsive, accommodating, and supportive. The over all environment was not the best, but it was a great temporary job."
King Soopers,1c5hi6qi0ake2967,5.0,Working for King Soopers yielded many friends of whom I am still in contact with. The other employees made me feel more than welcomed and like I was accepted in the workplace. One of the main reasons I am no longer employed there is due to the fact I learned I wasn't the best at dealing with complaints with minimal emotions.
King Soopers,1c5efqnuhaki5fcr,2.0,"managers were to busy to offer training or advice, no team work, always point blame, no upper level support, not enough sanitation, not enough help, high turnover, compensation needs to reviewed"
King Soopers,1c5ctto63aqi6e0m,5.0,"worked for them for 4 and a half years, its good for the above average health insurance. Around $8:50 gets taken off automatically with your weekly check when you sign up for their health care."
King Soopers,1c5c550j3akafecl,5.0,King Soopers was a good Job. It kept me busy being a courtesy Clerk bagging Grocerie Items. Smiling at c.ustomers. Taking food breaks. Pushing Carts was easy
King Soopers,1c5a0n3mcak6c9fm,1.0,Most disgusting job I've ever had. I had to clean the restrooms and the entire store ever hour or two. and dump every departments trash as well as help the front should they be short staffed or should it be busy.
King Soopers,1c59k8kgcake287o,4.0,As a night baker I had the benefits of working full time and getting a night premium of almost $3 on top of my existing pay rate. Management was friendly and easy to get along with. The most difficult part of the job was working the holidays as that is when most departments are super busy. The most enjoyable part of the job is that it was all fairly easy.
King Soopers,1c59bpea8aki5d2v,4.0,"I enjoyed connecting with my customers on a daily basis, providing them with a beverage they know is made just the way they want it. As a lead, I learned time management, budgeting, ordering and its many hardships; overall, I learned how to connect with not only customers as I'm the first person they will come to with a question, but with my team as well, as everyone has a different learning style and needs different ways of approaching them."
King Soopers,1c59041a1ak6cdh3,4.0,I had an issue with the store manager when my niece was born. She almost fired me because I was going to be an hour late since my niece was born and i was the only family my brother had at the hospital that morning. She has since been let go.
King Soopers,1c57i2efeaki3cak,3.0,"The everyday atmosphere wasn't so bad but there were many stressful days due to upper management. Every other employee for the most part were kind and awesome to talk to. However, store management can come off rude and overbearing. There are a couple of individuals that have been blatantly rude and condescending many times while working there. The main thing that pushed me to find another job is that I was told at the beginning that they would work around my school schedule. But recently was told that they refused to work with my schedule and would be forced to transfer to the front end as a bagger."
King Soopers,1c54jde9qaki18go,2.0,"As a manager of a department, several years ago, when I first started,  we were encouraged to run our departments as we saw fit, we were trusted and taught how to be business minded and were reviewed and praised on our performance."
King Soopers,1c544np0qak67dbl,1.0,"Poor management, poor corporate, poor environment, poor benefits for low ranking staff members, poorly staffed, insufficient wages, little to no incentive for part time employees"
King Soopers,1c53tvabqaka8b2u,4.0,"Fast-paced environment, Have been learning a lot of medical terminology, Pharmacists I work with are mostly great. The pay is super low. Would like to learn new things in hospital background."
King Soopers,1c4vtbt54ak5tema,1.0,"I worked there for 8 years. And once I hit 8 years it wasn't so bad. They say they will work with your schedule. That is a lie. They schedule based of seniority. So when you start off you don't get to choose your shifts or your days off. They give you the left overs. With being a union it means they keep all the bad workers around because they can't fire them easily. So the bad workers pile on seniority and have control of the schedule. Wasn't fair. I would work harder, faster and give better results than my co workers and yet I had to beg and plead to get days off I needed for my son. I almost didn't get to have his first birthday off. You don't get any insurance or vacation days or sick days until you have been there a year. And the insurance is only medical. You have to wait 3 years before you can get dental and eyes. And you get one week vacation after a year. And then you get an addition vacation week at 3 years. And the one more additional week at 5 year. You can never really use your sick days. You have to be sick 3-4 days in a row, and get a doctor's note before you can use them. I was under the impression you could use some of the hours if you had to call in sick. Management sucks the most. They put unrealistic standard on everyone at the store and if you don't meat it they yell at you and treat you very poorly. Management will back stab you every chance they can get. It seems like they just enjoy making their employees life the worst they can. I seriously wouldn't recommend this job to anyone. This company is taking a nose dive and everyone working there should get"
King Soopers,1c4tf001rak5tavj,1.0,"This job is miserable, and literally bad for your health. Don't take a job at a grocery store unless you have to, and try to make it as temporary as possible. Thank you, and goodbye."
King Soopers,1c4svfea7b89vbdn,4.0,A typical day at work would usually be very busy. I learned good customer service working there. The management is good. The hardest part of the job is how busy and stressful it can get. And sometimes people can be mean and rude. The most enjoyable part of the job for me are the people I work with.
King Soopers,1c4okmma0akhodjj,4.0,Great people and a nice environment it can be very fast paced and you have to be able to keep up but other than that its a great place to work especially for a first job!
King Soopers,1c4nskihhakdla9u,3.0,"When I worked for King Soopers during the 1980's and 90's, it had a more supportive work environment and better wages and benefits than found today. But while employed for this company I enjoyed part/ time scheduling flexibility with a wage/ benefit package that allowed me to support my living and educational expenses. I began as a courtesy clerk for under a year, followed by a promotion on the night re-stock crew for 12 years and concluding as a cashier for 5 years. I thank King Soopers for their role in where I am today."
King Soopers,1c4nlh6avak5tcfm,3.0,- 10 hours plus work days
King Soopers,1c4nl7duiaka0b69,5.0,The managers that I had were all good to me made a lot of friends at king soopers it was really busy most days you had to fast paced as a cashier working in general merchandise was a lot more fun stocking shelves
King Soopers,1c4j662i4akdlc12,3.0,"Worked as an overnight stocking associate. most time spent ""conditioning"" aisles, which meant pulling each item slot to the front, and restocking misplaced items while customers were shopping."
King Soopers,1elgoaakcu2j4800,4.0,"I had very good relationship with managers, they were responsive, accommodating, and supportive. The over all environment was not the best, but it was a great temporary job."
King Soopers,1c4ib499g5j5kahm,2.0,"stressful, no leadership, no hands on management, the expectations set too high, and no offer for assistance when I needed it ,Always criticized and never given encouragement for jobs well done."
King Soopers,1c4i0u6lcakdl96c,4.0,"I worked at King Soopers for almost a year, and during that time, they told me that working is more important than education. Management would schedule me during school hours (while I had 2+ hours left of school) and they would never listen to any of my concerns regarding the issues."
King Soopers,1c4hsjaho5ndkbt9,5.0,"I was a courtesy clerk. I would collect carts, bag groceries, cashier, and used customer service skills everyday. I loved this job honestly the pay was great and all my coworkers were very friendly."
King Soopers,1c4fo70moakdg9a5,3.0,"I was a Floral Clerk with no past training, The lead in the Floral Dept. never gave me proper training. The hardest part of the Floral Dept. was picking up the Floral Dept. buckets that were filled with water. We had to clean those weekly."
King Soopers,1c4d2d38jak5nc62,4.0,This was great place to work. I had very little job experience and actual skills. They hired me and trained me. It gave me 6 years of customer service experience and training. This job was a great starting place for my career.
King Soopers,1c4d18vg8b81oall,5.0,It was a wonderful place to work for and with amazing benefits. Pay was great and 401K and paid time off and great health insurance with dental and vision.
King Soopers,1c4aglbrpak5ndtj,1.0,the job was fun and they gave employees lots of freedom to help customers in anyway. But for the time i was working there they paid cashiers and baggers different wages and as a cashier i was paid a baggers wage. after many countless times talking with HR this issues never got fixed. floor managers would make you go on your lunch break a couple hours late if the front was busy. often times missing a lunch. when i went to talk to the store manager about these issues. he had no idea this has been going on. they really take advantage of employees in highschool.
King Soopers,1c48a0davakdgetm,5.0,"Every day at work was a blessing, the customers were very kind. Every holiday we celebrated with food and drink, and were able to leave at a reasonable time."
King Soopers,1c47rl71dak9rbpg,1.0,They reason I left them was because I was part of a 1st time processes that they wanted to try. They said that if I didn't want to stay in it I could just be placed in a store near me and would just do what i learned at that store. When they told me that they would be moving where I was working and I told them I could not they just stop talking to me and would not call me back or pick up the phone. In the end since they never told me what store I would be placed at they just left me out of it and I was not able to work for them anymore.
King Soopers,1c47odvkvak9rd25,3.0,Days can be Monotonous but are usually fast paced. There is always something to learn. Management is usually competent. The non management workers are generally great people. Hardest part is the heavy lifting.  The best part was that I pretty much had the run of the department because of my experience.
King Soopers,1c45d2vtuak9r8ee,3.0,Too many young and not trained people in management. Only kind of good thing about the company is the union. Under staffed at almost every location. Inconsiderate managers
King Soopers,1c43uh25nakdgent,4.0,"Good beginner job, flexible hours, decent pay, plenty of opportunities for promotion, respectful team members, good benefits, and good managers. Good experience in general"
King Soopers,1c43tpgc5akhje2i,3.0,I feel like this is forced and contrived to make me sit here and fill out a review for a company I haven't been with in three years. I was only 16 working there and i don't think this would be a fair review.
King Soopers,1c43e978gaqhia47,5.0,"I was in charge of money orders, tobacco sales, refunds, and assist cashiers along the front end with overwhelming peak hours. Anyway I enjoyed working for this company, but stress from home made life working here miserable and I would get into an argument with a costumer that I've come to regret."
King Soopers,1c42m32lrb85kdj8,5.0,"I absolutely loved working with our customers!  This was a great job for someone who loves people, the energy of the fast pace, and being able to create delicious desserts.  This was one of my favorite jobs. The Kroger Company is a fabulous company to work for.  They donate so much to the local communities.  That inspires me to work even harder for them.  They do a great job of caring for the employees.  They have have employee driven programs to empower, motivate, and thank their employees.  I would work for them again, and encourage others to work for them also!"
King Soopers,1c3tues46ak9jfj6,4.0,"Fuel Center associate; customer service, stocking inventory, credit card transactions, extremely friendly work atmosphere with co-workers and management, family oriented organization"
King Soopers,1c3th5c68aqhc8vg,4.0,"Great place to work as a first time job. Pace is fast, but there is a lot of room  to grow. Convenient for local housing. The employees always try their best to make shopping a fun experience for customers"
King Soopers,1c3r7b0u35nd78s9,3.0,It always depends on the location but managers are very caring . I didn’t like that i would work 50 hours a week and still wasn’t considered a full timer. I think that’s illegal
King Soopers,1c3mhpfotb89dcoj,5.0,"Cashing payroll checks, accept Utility payments, rent out movies  lottery .  How to manage money very carefully.  Management was fair. workplace environment was tolerable. the hardest part was drawer not balancing .  All the wonderful people who I worked with and all the good people I had met."
King Soopers,1c3m6huqdakd98ot,3.0,"Holding several titles within this company, I can definitively say they are not interested on advancing an individual based on their performance or skills alone."
King Soopers,1elgoaakcu2j4800,4.0,"I had very good relationship with managers, they were responsive, accommodating, and supportive. The over all environment was not the best, but it was a great temporary job."
King Soopers,1c3gu13tjbrd2d43,2.0,Associates are fantastic.  It is easy to make friends and fit in.  Some managers are helpful and encouraging.  There are some great training classes offered.
King Soopers,1c3f8fjrg5n92bu8,5.0,The team is very helpful and energtic and willing to help one another and the work enviroment ware you will be able to grow and have fun at the same time
King Soopers,1c3esjfqnak9e9d7,5.0,I started at King Soopers when I was 17 and have been a Barista there the entire time. I have learned a lot over the years about the importance of team work and communication. Management at King Soopers was insistent that we follow these 2 rules and develop them into skills. Our team at the Starbucks Kiosk was a well oiled machine.
King Soopers,1c3cv099tak9ecl2,1.0,Bad management with inconsistent hours and little to no scheduling flexibility. Late hours/early mornings and no benefits for part-time workers. Won't be considered full-time unless you are working exactly 40 hours a week.
King Soopers,1c3b8qh8eaqh2du4,2.0,Working at KS was fun at first. People were nice but the hours get to you. Working weekends and nights with a random day off here and there gets old. Some days its a 5 hour shift others an 8. Some days its a midmorning while you closed the night before... Just not fun when you are married and like to travel. Nice no brain jobs but hours are not friendly toward evening/weekend life.
King Soopers,1c38vk6u1akcsb0o,4.0,"I honestly didn't have a problem with the management team, most of them were always focused on the job and their team. Although moving up in King Soopers was a bit more challenging than other places I worked,but overall I think it is a good place to work."
King Soopers,1c36fg3n35n8q8tu,5.0,worked too many days straight without a day off. I liked the position and I am a hard worker but he schedule was to difficult to keep up with as far as scheduling
King Soopers,1c31v2or0akcsb9k,2.0,Reliable job good rule that management has to follow with union the bad think is low pay rate and no 401K or PTO. Easy to transfer to another store if you don like the one you work at.
King Soopers,1c31cqgbiak95esk,4.0,"A simple job, King Soopers is the best place to start. I recommend the position to students and anyone looking to get into retail. The management is solid, I always received breaks on time. The hardest part about the job is trying to help multiple customers at the same time or having to call a manager to assist you when it is busy."
King Soopers,1c2te4ecdak50a6u,2.0,"I was still in high school upon being hired, and they refused to work with me and my school hours. They had me working until 11pm every single day, and I just couldn't balance the two, and was forced to quit so I could keep my grades up. Now that I'm out of school, though, I'm sure it would be fine."
King Soopers,1c2sr3nm6b853e8j,1.0,Was fired for taking a week off when my son was born. I had permission a month before taking it and when I went back on scheduled day I was told I never requested it and was ambushed by 5 managers insulting my work behavior even though I never heard about it before that. They want kids that don't have an opinion and don't need money beyond buying some fast food or makeup.
King Soopers,1c2rphbmf5ncqcpe,3.0,"This type of job is fast paced, and they see so many people come in and out. Because they have such a high rate of people coming in and leaving they don't give much attention to new employees or care about your work ethic."
King Soopers,1c2pmlmbhas0v81d,4.0,This a good and safe work environment for high school and college kids. Its always a good thing to stay on task especially on holidays and when football is going on.
King Soopers,1c2ep1f2gak50d58,2.0,I enjoyed working with the customers and being active through out the day. i also worked with some really great people who were  great to work with...
King Soopers,1c2d6oterak92cto,3.0,"typical for a retail setting, medium to heavy workload, hours vary depending on site, cut-throat upper management, unclear conveyance of rules and regulations but with out of proportion consequences;"
King Soopers,1c2d2u3t1as0vch2,3.0,"If you are OK with whatever is given to you, you can have a 40 hour work week or less. Be prepared for hard work on your body and lots of time on your feet."
King Soopers,1c2css3lkb850bdm,2.0,"In the last couple of  years the company no longer values there associate.  A lot of people are leaving the company, as well associate turnover is higher then ever now"
King Soopers,1c2cc01daak50a3a,5.0,I was proud to work at King-Supers.  They gave me a clean environment to work in and a safe place to earn money.  I liked most of the supervisors.  (No ones Perfect)  I earned a decent wage.
King Soopers,1c211pfv8ak4u97h,3.0,Hired on as a courtesy clerk. Cashier did not deem appealing with all the bending over. I am shocked on the worn out vest's and cheap strap they use for getting the carts at least at my store.Embarrassing to say the least. Not even a decent coat rack for us. We have to double up our coats over other workers.Billionaire dollar company?Day two a manager got mouthy with me. I let it go. I am retired anyways and  just doing this gig for something to do. I plan on three months in the front end then I will transfer to maybe produce. Decent coworkers I like just about all of them. I don't recommend this job as a career if you have a lot of bills and family. I like the fact that even the store manager will bag groceries when the stuff hit's the fan.Give it a shot if single and no family to worry about.
King Soopers,1c1tcv2olak90bi6,4.0,"No front load belts for the regular registers means bending, constantly, into and out of the cart, which puts a lot of strain on the back for those over 6 ft tall."
King Soopers,1elgoaakcu2j4800,4.0,"I had very good relationship with managers, they were responsive, accommodating, and supportive. The over all environment was not the best, but it was a great temporary job."
King Soopers,1c1okhhgkas0lfk4,3.0,"Not bad. I didn't intend to make a career out of my stay but it is entirely possible to do so. However management does play favorites when it comes to job promotions according to my observations and first hand accounts from coworkers pursuing management positions. Expectations coming from the top are always enforced rather than tried and true sensible and efficient practices. With that being said: If you're looking for steady work with competitive pay and benefits, King Soopers just might be right for you."
King Soopers,1c1obrlt3b84lbd7,4.0,I enjoyed interacting with the customers and working with my coworkers. Loved learning new things that I had there.Enjoyed the fast pace I was expected in scanning products and helping customers find what they were looking for.
King Soopers,1c1mj0vbraqgkdjt,5.0,"I really enjoy working at King Soopers, they are very positive with good communication. There are rarely any rough days and if there are we help each other out. There is little to no drama and we all get along really well."
King Soopers,1c1ldolotaqgkc23,4.0,"It is what it is, a busy grocery store. The hours are all over the place. Overall it's decent if it's the environment you want to be in. Just smile, help customers and get through your day."
King Soopers,1c1dps527b84ld22,3.0,There's always a lot to do. I got the chance to work with a lot of nice people. The job is really repetitive though and the turn over rate is rather high.
