Company,ReviewID,Rating,Review_Text
King Soopers,1ale8ni6iak5t8vg,4.0,"Working for King Soopers is ok. Most days are working busy on the weekends since most people have time off to come to the store and get groceries. Some customers are nice and understand how the business is, but other will try and take advantage of the store to try and get money back. Management was good for the most part as far as the store management, but some department management can get very messy at times. Most of the co-workers I have worked with are nice people, including some of the high school kids, but some you can tell have worked there foe too long, and want no part of being in a team. The hardest part of the job is putting up with difficult customers, because you don't want to make them mad, but you also want to obey the store policies to avoid from getting a write up. The most enjoyable part of the job is being recognized by customers who acknowledge how hard the employees have worked."
King Soopers,1elgoaakcu2j4800,4.0,"I had very good relationship with managers, they were responsive, accommodating, and supportive. The over all environment was not the best, but it was a great temporary job."
King Soopers,1ale3173aak5tf81,5.0,"good environment, management was ok co workers are ok there was no hard part of the job ................................."
King Soopers,1alau12tdak5j8v9,1.0,"As an associate in Lower management at King Soopers I have had almost the worst experience working there in my entire life. I learned a lot through the intense stress and tough situation the stores of this company go through on a daily basis. A typical day for me as a night crew foreman is starting at 12 o'clock midnight, going over the daily paperwork and checking emails to see what is current with day management, bringing down repack, unloading a truck stocking our older stock to the shelves before stocking new stock to the shelves and them bringing every item in the store forward before 7 am. sometimes not even getting off work until 10am-3pm sometimes! The people who work there are quite nice but highly taken advantage of by the higher ups, and never fully trained or given proper training before being given responsibilities. the most enjoyable part of the job would be being a good leader and role model to my associates. the hardest part is dealing with the unreasonable expectations giving to the associates and still trying to keep their moral."
King Soopers,1al83m6e0ak5j9l2,2.0,"Kings was a great place to work. As time passed, the company focus moved away from traditional Grocery practices to a contrived series of corporate directives that did not support daily operations. This process of change required sub-standard management recruits. The resulting in-store management teams lacked the experience or competence to maintain  basic daily operations. When corporate leadership visited the stores, hundreds of hours of overtime was required just to present a normal level of service during the time of the visit. Communication was happenstance and ineffective. Management follow-through was non-existent. All levels of in-store management participated in ""The Blame Game""."
King Soopers,1akkej6auak9bfvk,4.0,"I worked for kings soopers in lafayette and the manager was nothing but rude to me when I had to leave work to go to the emergency room for strep, then demanded me come back in for work even though I was contagious and had no way of talking."
King Soopers,1akjp1bn6ak9bdc2,2.0,"i worked there for almost a full year. then at one point they stopped working with my availability and started writing me up when i was unable to meet their availability. very disapointing. It was a good job to get by, but they have no respect for their employees."
King Soopers,1ak9l94f5b86mcbc,3.0,the manager was rude and very condescending. She told me that I could have two days off specifically in a week do to weekly appointments then scheduled me for those days. I did advance from courtesy clerk to cashier pretty quickly though. All my coworkers were amazing and helpful while learning the ropes.
King Soopers,1ak8uf52cb82iavu,5.0,"I enjoyed working for King Soopers. Management is very helpful, great atmosphere and co-workers. They recognize you for a job well done, they also have many employee appreciation days where they provide lunch and other giveaways. Its a great company to grow with a lot of potential to move up within the company!"
King Soopers,1ajnm5bogak62eq4,3.0,"Break down skids of load, while insuring all employees are on tasks and reviewing all orders. Ensue all price corrections are hung. Condition the store. Stock all products and ensure displays are full. Shop displays to the shelves as needed. Condense all products in the seasonal aisle and ensue pricing remains intact. Review stock conditions with day person, review any out of stock issues as well. Write schedule to company guidelines, review with clerks and make all corrections. walk the department and review findings with management."
King Soopers,1ajdetqmoas17elo,2.0,Maintenance at this place is treated as a lower than janitor position.
King Soopers,1ajas7giras17avl,3.0,"I was just a simple floral clerk for King's, it wasn't hard or anything like that but the management around me was totally incompetent. I learned how to take care of plants and properly water them, also how to provide great customer service to every patron that entered the store. The hardest part of the job was dealing with my co-workers who constantly didn't want to work which made for a very weird environment within the store. The part I enjoyed the most though was getting my paycheck every week because at least we had that, all though the pay for someone with my title was just a little better than minimum wage."
King Soopers,1aj7rdk5pak5rf2v,5.0,"everyday was challenging, but rewarding. management was great. Anytime you needed anything, the support system was great"
King Soopers,1aj3jkalub85fblk,4.0,Overall experience while working at King Sooper's was exceptional. Highly recommended for teens and young adults to start here as their first job to gain experience in the workforce. But none the less a very productive and exceptional and diverse working environment.
King Soopers,1aj2jjo24ak5g89k,3.0,"A typical day would consist of around the clock customer service, bill payments, cash holding, money transactions and mid level customer service"
King Soopers,1aith8gv11bgf6sk,3.0,"King Soopers management never understood the meaning of ""part-time"" and this was why we clashed so often. The repeated promises that they failed to uphold concerning scheduling were very difficult to endure, and eventually led to my loss of willingness to work there. They were trying to leverage seniority and other immature factors against me, which I found demoralizing, yet everyone I spoke with had had the same experience. This is possibly why they have such a high turn-over rate at their store locations in Boulder, CO."
King Soopers,1aiolh9ebakaqf1k,3.0,It was a good job just to make a little cash . It is a great job for a kid during the summer or a kid starting off to get experience under the belt
King Soopers,1ai1271etak7jaes,3.0,Hard conditions
King Soopers,1ahvcvscaak7j975,3.0,"A typical day at work for me is fast paced, which is ideal for me.  I love working with the customers even during stressful times.  Management in the company can definitely use some more work."
King Soopers,1ahq0u83u1d0v5pc,5.0,"My day usually started with picking up orders from bakery and deli and shopping grocery orders, getting the rung up and then getting my delivery van and loading it with all the delivery orders and delivering them and collecting money and returning it to work. After completing deliveries came back turned in money collected and loaded up more deliveries and delivering them and collecting money. Pretty much doing that the entire day. At end of day turned in rest of money and change bag, turning in the delivery log and parking the van in proper place. Coworkers were great and very helpful, hardest part was mainly the weather if it was really cold and snowing and the roads were icy, Mountain deliveries were especially hard during those times. The most enjoyable part was getting out and seeing everything you don't see when you are stuck in a store with no windows. The fresh air."
King Soopers,1ahpq9k3vak94dt3,3.0,"union was an interesting experience. Management doesn't really listen to feedback from anyone, customer or employee. good work environment if you fit in. allot of drama between coworkers. alot of dating and childish behavior. greedy comapny"
King Soopers,1ahfv8394ak7j8tc,2.0,"Learned about money transfer laws helped check out when the store was busy, enjoyed the people. Enjoyed deliveries when people home shoped"
King Soopers,1elgoaakcu2j4800,4.0,"I had very good relationship with managers, they were responsive, accommodating, and supportive. The over all environment was not the best, but it was a great temporary job."
King Soopers,1agvg3n4l1ahe2ge,1.0,"Stable, low pay, lots of corporate bs. Company hates graphic designers. Don't work here. Management has there favorites how have less work. They claim to have a competitive salary and the possibility of advancement buy those are lies."
King Soopers,1agdnico3b8368gk,5.0,Excellent working environment.  Great employees to work with.  Hours seem fare.  Hardest part of job is quantity of products especially during holidays.  I really felt supported when I could count on my fellow employees to help when needed.
King Soopers,1ag5n7jmuakbobnk,3.0,"A typical day at work can be challenging at times. I have 2 types of people who come in good and bad. Most of the time i have to remember they are customers. On the other hand, the good people (regulars) drive through. Indeed, they make my day. What i learned from a fuel Clerk job you have to have a good attitude and be aware of sales, checking gas pump equipment, also a clean environment. Management are always welcoming and they will always have something to resolve a problem to work around it in a good way for their emplyees. The coworkers on the other hand some can be good some can be bad. Either it was the earliest they work or families they attend to afterwards. It is understandable. But I give a good respect for the coworkers who work hard for their families, money on the side for school, experience if they are in high school. As far as the hardest part was the minimum wage for a twenty year old to make ends meet. Rent, utilities, fees, phone bill, etc.The most enjoyable part of the job was being with people who I got along with. Don't get me wrong i get along with everyone. It just depends if you want to speak up and get to know me."
King Soopers,1ag1kab3has3c820,4.0,"A typical day at work includes reviewing and responding to e-mails, walking store in detail for presentation, compliance on programs and state and federal regulations and talking with employees regarding their departments status.  I am available to my customers and employees throughout the day.  I have learned that satisfied employees creates a productive work environment."
King Soopers,1afs52dpvak5neq5,4.0,I loved working for this company. I had a good experience at the store as well as learning to provide excellent customer service. I am grateful for the experience and knowledge I have gained from working here.
King Soopers,1afpvbladak5nbsd,1.0,They make you work really hard for too little pay. Comments of needing help or hiring more people fall on deaf ears. They suspend you before they give you a ride up and investigate the reason. But if they realize they were very short-handed (this is why i work thriugh lunch akmost daily no breaks except bathroom)how do they expect you to be perfect. If you pay peanuts you get monkeys and King Soopers is turning into a zoo
King Soopers,1afot5ihpakb1anj,2.0,"Job pays very well, but management is unprofessional & play favorites. Kroger only cares about shrink, but took away the tools for us to stop shoplifters. They rather we observe & report & not get involved."
King Soopers,1afjirfh5akame5q,5.0,"Enjoyed working at the front desk, greeting clients."
King Soopers,1af432lblakabano,4.0,"I worked multiple different departments and locations throughout my 11 years at King Soopers. My last position at King Soopers was Night Crew Foreman. I would arrive an hour before my crew to start setting up. We would spread the pallets of product throughout the store, then spot the items near the location to stock them. After stocking the items we would face the shelves to make the store look as nice as possible for the day of business to come. I learned a lot about maintaining inventory and what items sold most at the different times of the year as well as the different locations of the stores. Management was very educated and helpful. Most of my coworkers were very fun to work with and pitched in extra help when the crew was short handed. The hardest part of the job was training new employees that felt the position should've been easier and they were resistant to working hard and eventually would quit. Not all new employees were this way, but the ones that were-were difficult to deal with. The most enjoyable part of my job was the exercise and the upbeat attitude that most night crew employees possessed."
King Soopers,1af1fkicuaka8eor,3.0,"The employees were very friendly. The management was fair most of the time. I enjoyed the work for the most part but they wanted more all the time. The pay was not very good, Kroger company has many benefits if you are working full time. Part time employees were not privy to all the benefits"
King Soopers,1aenfhm3jas1uc6m,2.0,A typical day at King Soopers is breaking down the daily load and stocking it to the shelves for the customers. Customer service is a daily activity that is very important to the company. I have learned to order for the needs of the store. Hardest part of the job is the manual labor attached to it. The most enjoyable part of the job is working with the amazing employees that also work there and some of the vendors that come into the store.
King Soopers,1aejr6t0sb81maeg,4.0,"My typical work day was pretty busy and could have quite a lot of physical labor ,but allowed me to learn many things that I ,honestly, should have known. My co-workers were very accepting helpful and friendly. I loved almost all of the work but carts was probably the hardest part of the job."
King Soopers,1adttivn0b81mc8n,2.0,"overall the work place is a atmosphere for some people. management is never on their game, but learned a lot from the people that were actually dedicated and wanted to help others."
King Soopers,1ados1e6jas1uai1,3.0,"Working there is a typical job , no frills or thrills . The management team really needs help and training on how to communicate with their employees . At my store , the mgt team always bashed the mentally disabled and was not fair at all to many other employees"
King Soopers,1adc0tgeiak9o9ck,4.0,"The days went by quickly; hardly anytime to breathe, though. The service desk is extremely busy. I was pushed along very quickly and left alone to learn on my own too soon. Sometimes found it hard to get someone over to help out with things I didn't know how to handle - which there was a lot. For what you're expected to do, the pay was way to low."
King Soopers,1acpk9svdak7se9j,3.0,"I enjoyed Helping people and the people I worked with. Did not like the fact that it was not full time. I stocked shelves,cashiered, rotated stock and removed out of date and damaged product to reduce shrinkage."
King Soopers,1acnhon37ak96c6m,5.0,It is a great place to start and learn to grow. You can work your way up fast and learn how to be a manager and what will make you successful. They really do care.
King Soopers,1ace79n6bak7jddl,4.0,i was always busy and on my feet i got along with my coworkers and  i learned how to do new things like cashier. the hardest part was during the holidays because it was busier then normal. i enjoyed working with my coworkers to get things done.
King Soopers,1acd77ap7b84oetv,4.0,"Going straight into guest mode here, you learned how to handle guest in any manner. The management very strict. Everyone was very friendly and worked hard here. Hardest part of job was bouncing between lanes. Most enjoyable part was seeing everyone I know in town."
King Soopers,1accj29gtas178kf,2.0,Same routine which made it very boring but there was never a time I didn't have anything to do. Management never seemed to care to get to know you or talk to you.
King Soopers,1elgoaakcu2j4800,4.0,"I had very good relationship with managers, they were responsive, accommodating, and supportive. The over all environment was not the best, but it was a great temporary job."
King Soopers,1aca6h6fvak8q9gt,3.0,"my typical work day was always productive,"
King Soopers,1ac5gg3e75ne5dg8,4.0,Can be a really good career if you put in the initial time and can handle retail hours. Starting out can be tough and difficult learning everything and how to get it all done. Depending on your position and time of day your work day can be steadily busy and go by quick or slow and drawn out with a couple hectic of times. Be ready to be on your feet all day and deal with repetitive and/or moderately hard work. No matter the economy everybody needs to eat and is union so has good job security.
King Soopers,1ac2mhae7ak78crj,1.0,"Terribad. Like really really bad. Don't work here if you can avoid it. I have heard better things about other stores but mine was poorly organized, poorly manged and the culture was absolutely horrid."
King Soopers,1abvtdc4sak78fsm,3.0,No job security along with no training accompanied by accountability for what you don't know. If you are moved to a new location then you have to start over on proving yourself.
King Soopers,1abtn21uuak78ehm,3.0,managment is poor.i loved the job i wish they had more faith iin there employees...i learned quite a bit. i wish i couldstill work there
King Soopers,1abs7u5bjak8qbcd,1.0,Poor Mgmt skills and poor control.  Mgmt was was worried about their own jobs.  Frightened on a daily basis.
King Soopers,1abqu6vhlak8q8h5,5.0,"I really liked the retail experience at King Soopers. We had a fast working environment. I learned how to get my jobs done in a limited time, how to deal with customers, how to dispense medication safely and accurately and many more. I gained a lot working there."
King Soopers,1abqa705sak78ak3,4.0,"Typical days consisted of taking care of patients with their medications. We made sure that our customers were satisfied with the service and helped them to understand their insurance copay. We would enter in prescriptions making sure our the information on the hard copy matched what was on the computer. We fill prescriptions and made sure we matched the bottle to the label that printed out. Next, we would release the medication to the patient and ran the registers. Working here made me learn numerous things, From handing out scripts to ordering controlled narcotics to managing old prescriptions and knowing how to properly put them away for storage. My manager is wonderful he is a hard working person who is neat and knows what is needed to be done when certain things are due that is required by corporate. He makes our day easy and not frustrating at all. My co-workers are wonderful they help me when I don't understand some of the rejections the we get from insurances. Its nice when you have some one else there who can help you when its something you get stuck on. The hardest part of the job is customer service and making sure your patients get what they need. Its tough sometimes when you don't have the answer a patient is looking for. On top of that you have to meet corporate's standers of how fast you need to be when a patient is waiting for their medication. They require at least 15 minutes of one prescription to be done. It can be tough sometimes when you have 10-15 waiters come in at the same time and on top of that you have to help your second window which is release to"
King Soopers,1abmqdge41d0h2i2,2.0,"The company has no consideration for employee's lives outside of ""King Soopers""! The pay sucks, and there is little opportunity for advancement unless you are a ""favored one"". Overall management is terrible unless you have the opportunity to work for one of the very few exceptions!"
King Soopers,1aa1vp01u5nd7aji,5.0,Fun and easy! Not much explanation needed here.. you stock fruits all day. clean and take care of customers! 100% customer service required! Very interactive! Fun!
King Soopers,1a9t3d5r0ak5ra9t,4.0,This was my first job so i don't remember much but it was very easy and the people there where kind of care free. Nothing to hard to handle just make sure you have good customer service and you are on time every day. over all it was a good experience. The management could get more organized .
King Soopers,1a9qo3v1vak5rbr8,3.0,I learned a lot about hospitality and the workings of retail. the cheese island taught me a lot about the culture and history of cheese and how to apply my carisma and knowledge to supply the best and most personal service as possible.
King Soopers,1a9q902csb871bib,4.0,"I worked eight hour shifts, while bagging groceries, cleaning, checking groceries, pushing carts and helping with any customer service required."
King Soopers,1a9gknhvtakbfags,4.0,"Working at this store, i was always busy with little down time. I was able to expand my work experience her by having shifts in 6 different departments within my first 8 months of working here. I was then able to quickly start and finish my management training and get the promotion within two and a half months."
King Soopers,1a9gae4n6ak5rcv5,2.0,"We're do I begin! I was trained by someone who was leaving, so she didn't care how I was trained! Within my first week 4 different people trained me? Four different  ways! Confused, yes I was! I was told there would be some nights! Well technically  no I worked a 2 am  shift to 10:30! They normally have 2 full time bakers but at the store I worked they had one! So I opened on his days off! the other days I came in at 5 or 6 am! So sleep was all over the place! Days off were also or non existence! The schedules were not out by Friday when the new week begins on monday! Which made it hard to plan anything at all! I had a list of things I needed to do,I worked my bum off, came in before time, worked through my breaks and still didn't get them done! Then they added things to my list? The frozen bread was clumped frozen in a block mess! So I'd have to unthaw them work them into a loaf, which took time away from other things! Things I had no control over! My 45 day review was awful! I was crying knowing I was doing all I could and here they were telling me it wasn't good enough! They were going to move me to bakery clerk and cut my hours! Since every day was different the next day I didn't have that much to do and got all done! The management  was all about their schedule! They would leave to go take smoke breaks leaving me to deal with everything! The phone, customers, the ovens etc! I was lamb pasted for not getting to the deliveries  put away! which even the head baker at times never got too!  The one manager left notes one day explaining my opening as a bleep show,leaving it where"
King Soopers,1a9e9qce9ak5rc59,3.0,"I say good environment because its working with customers that made everything better, I like seeing are regulars come in and joke with us. My boss was awesome. Showing that I was working hard and if any stores needed help and need more hours she would ask me to go to that store to help out with other co-workers meaning I got to work with different people and see how that store did there deli and maybe learn something new. Yes, I did have some co-workers there that did not work well with others since they worked there longer and didn't like the changes or didn't like helping people out if they were busy but like I said at the beginning working with customer at the store made it all better."
King Soopers,1a9b6e2oh52tmcsk,3.0,"Ensured all aspects of retail sales and customer service associated with each department. Responsible for recommending and assisting customers with selecting products, based on their specific needs. Responsible  for keeping all meat, seafood, and deli sections well stocked, while providing accurate inventory control and documentation. Eagerly provided additional help, to ensure all store and departmental requirements were met. Exchanged returned merchandise for customers quickly and efficiently."
King Soopers,1a91nltsuas38eqc,5.0,"A typical day at work was watering flowers, cleaning the bins they were in, and putting orders together."
King Soopers,1a8cin46tb86ce36,1.0,"Kingsoopers is a very hard job to like, you cannot ever make anyone happy, the managers blame you for anything so they don't get in trouble, and its a thankless job."
King Soopers,1a8agbm17akanank,2.0,"a typical day at work requires you to be on your feet,the managers are effective and friendly ,the part i enjoy most is interacting with the customers"
King Soopers,1elgoaakcu2j4800,4.0,"I had very good relationship with managers, they were responsive, accommodating, and supportive. The over all environment was not the best, but it was a great temporary job."
King Soopers,1a7pvisi9akanbs8,3.0,"They say they are family oriented, but they want you at work 24/7 no matter what family oblations you have."
King Soopers,1a7a8s5of5nbacps,5.0,"Good place to work, enjoyed helping people daily. Got along well with coworkers and management. Excellent people skills."
