Company,ReviewID,Rating,Review_Text
King Soopers,1dbeh5c2o24e3004,3.0,Typical corporate mindset focussed on the bonuses earned by those way above you. Belief that the only way to make money is on the backs of the workers. Sets scheduling hours too low to truly meet the needs of the customers.
King Soopers,1dbcakest24f3000,2.0,They promote the wrong people causing stress on everyone else it depends on who you know and who you blow to move up. Always changing policy and trying new projects that don’t work and try to fit 16 hours of work into 8
King Soopers,1db5n462824f3000,2.0,"King Soopers as a whole doesn't seem to care about life outside of work. They expect you to be in the store to accomplish the tasks at hand, but they expect you to do this with no overtime and with minimal staff. They waste time and resources hiring and training new staff just to turn around and fire them for a failed drug test instead of waiting for those tests to come back before starting the training process."
King Soopers,1db3j4n4t24eh000,4.0,"A typical day (actually, night) at work for me is fast-paced, but not hectic."
King Soopers,1das492pf5ndr800,1.0,"Too much work and not enough people, but they dont care just get it done or write up. Have impossible standards that no human could meet. If you're friends with management that's how you get promoted, not merit based, it's how much you suck up the store manager. Problems, concerns, dont worry, they wont care."
King Soopers,1dargvrcb52te800,5.0,It’s a great place but it can overwhelming sometimes even in Sunday’s cause of the Denver Broncos games are sometimes on at Sunday’s but in other words it’s great
King Soopers,1dara7934h3pn800,4.0,It was ok people were good easy to learn some managers were easy going and good to work with others were lazy and would talk to certain costumers for 20 minutes to an hour
King Soopers,1daqgv7j5h3hr800,3.0,"They reward people for staying, not for working hard; if a 2-year cashier could work any role in the store, they can be paid less than the 50-year cashier who only runs self-checkout."
King Soopers,1daoqqp3a52t7800,4.0,Yes if I did not have to move I would have stayed u start at 10 work for 10 hours would stock shelves and clean up 5 days a week got paid twice a week
King Soopers,1dafat5ish3pe800,1.0,Poor place to work. Have to wait 13 months for medical benefits. No match on 401k if you are Union.
King Soopers,1elgoaakcu2j4800,4.0,"I had very good relationship with managers, they were responsive, accommodating, and supportive. The over all environment was not the best, but it was a great temporary job."
King Soopers,1da9rjkuth453800,1.0,"Management is favorable there is discrimination and not many minority in management or considered , crack the whip environment. lots of personal relationships and buddy system promotions."
King Soopers,1d9tfhiulh3h8800,3.0,"I learned how to be an employee while working at King Soopers. As this is my first job, I try to do what is needed and work hard while I am on the clock during every shift I'm scheduled to work."
King Soopers,1d9d691v1h453800,1.0,You have no chance of getting full time hours here. The management will tell you that you will get the hours soon so you will stay. Management plays favorites. Overall negative environment. Hours being cut regularly but they force you to stay on mandatory overtime when they need you.
King Soopers,1d991lncqh3gm800,1.0,i would not recommend working for this company. they do not work with you . nothing is ever good enough for this company . they do not care about their employees.
King Soopers,1d98qqkh9h40q800,1.0,"Dont work here unless you can take getting yelled at , if you expect managment to be on your side. Think again i would not work here if i could get another job. Very unorganized very unfair and not a loyal bunch of people.its not just one manager its all of them they think there so much over everyone. There just rude and very hateful.  Night crews fault for everything. Management got there jobs in a cracker jack box .. not one manager in upper management has never helped night crew they just sit upstairs and  talk about how bad night crew is. And how they walk circles around everyone. They walk in circles alright but not around us. Never a Thank you,."
King Soopers,1d966g1tuh40q800,3.0,"Department management was great but seemed to have no managerial power as they were often ""run over"" by upper management. Lack of teamwork and communication. Loved the work and my customers, hated the high school drama games."
King Soopers,1d8pafblf1ai8000,3.0,"Hardest job is being a courtesy clerk at Kingsoopers, based on customers mainly... dress code is way too strict, there is no expression allowed for employees"
King Soopers,1d8ojpjj1h40h800,4.0,"The people at King Soopers were ok, I did end up making good friends. The management was pretty ok they let me go on vacation whenever my parents planned a trip so they were flexible."
King Soopers,1d8m96cl21ago000,4.0,"King Soopers is a great company to work for! It was my first union job and I'm still not sure if that's a good thing or not. Some of the people in my particular store liked to play favorites, and that is unfortunate when that is allowed to happen in a work place environment."
King Soopers,1d8kjerph1agi000,2.0,"Great starting job. Management was horriable and made promises that were never kept and lead to myself ultimately leaving due to the fact. Otherwise, its a okay first job."
King Soopers,1d8ki2siq1ai3000,4.0,It was okay.  Working at Walmart would just be Easier for me and my family. It’s closer and I would rather work in a Walmart environment. I was referred by many people.
King Soopers,1d8kcen4o1ah8000,2.0,The daily tasks aren’t too difficult and other than busy periods the work load is fair. The management can be unprofessional at times but overall it’s bareable
King Soopers,1d8euqoc01agi000,3.0,"Perhaps not the best place for a permanent job, but definitely a good step in the correct direction and makes a good first job that teaches work ethic and minor management skills."
King Soopers,1d8d4q40q1aia000,3.0,Working there I had gotten real close to my customers and cried when I left even had customers tell me they were going to stop shopping there is I wasn't there . I loved the people I worked with and got along with everyone
King Soopers,1d897n0f11ahv000,5.0,"Supervised Cashiers, Courtesy Clerks, Service Desk and Fuel Department. Coached and improved employee performance and productivity. Utilize best practices to ensure proper bagging techniques, unloading carts and strive for the 3’A’s of friendly behaviors, Acknowledge, Assist, and Appreciate.	Maintained Daily Sales goals.	Achieved QueVision 90% 1+1 queuing to maintain customer satisfaction. Trained Associates on all Safety Requirements. Managed Inventory Control."
King Soopers,1d81vnvjv1ba9000,5.0,Great for all levels and departments.  Well organized company and clean environment.  HR is very professional. Great communication within all management.
King Soopers,1d7v8h81g24e5000,4.0,This store is super busy and really fast pace. It can sometimes be a stressful place but for the most part they are a pretty good place to work. You have to be able to mesh with a lot of different people
King Soopers,1d7uudg0k1ahr000,5.0,"Being able to see customers and being able to make sure they had the satisfaction of their shopping trip, and being able to communicate with the customers and being sure you can help them if they have a problem."
King Soopers,1d7uspp5i1ahc000,3.0,Overall this job is good. I like the people who I work with and enjoy the customers. The pay and the management were the issue mostly. I have worked for king soopers for almost 2 years and am still getting pay at minimum wage. This didnt change when I brought up that I have worked more than 1000 hours which is the minimum amount of hours need to work for a payraise.
King Soopers,1d7sgu2pi24ei000,5.0,I need a place where I can expand my horizons and opportunity’s to grow as a person. I love working there I just need a place where I can grow not only as a person but as a worker in this society.
King Soopers,1elgoaakcu2j4800,4.0,"I had very good relationship with managers, they were responsive, accommodating, and supportive. The over all environment was not the best, but it was a great temporary job."
King Soopers,1d5v63t7c24gv000,3.0,"Overall King Soopers is a good employer and advancement is semi-consistent. If you work hard and prove yourself, moving up in the company is possible. You are able to start off at minimum wage and move your way up to the District Manager roll or even higher. They pay for college and provide good benefits. However, the shifts are very inconsistent. Every week my shifts change along with my days off in the week. The work place is fast and you are always busy, whether it be cleaning or stocking. There is always work needed to be done. Can be a stressful job for juggling multiple tasks and getting them done in a timely manner."
King Soopers,1d5usts8jak4n800,3.0,A typical beginning of my shifts starts with completing peoples orders. Later in the day I  bring orders to peoples cars and explain any items we had to give an alternative item to or take an item off their order due to not having it in stock. I learned full on customer service as well as multitasking. Management in my specific department was great but outside of my department was very poor and I was treated poorly by them. The hardest part of the job is the way I was treated by other employees. The most enjoyable part of the job was the support I received for struggles within the workplace.
King Soopers,1d5nfhcb5b80n800,3.0,"King Soopers is a great place for task driven, focused people who want to learn and apply themselves. It is what you make of it, in a way. If you dedicate yourself as a dependable associate, willing to learn and take on more responsibility, you can elevate yourself as far as you really want. The compensation for store management and above is certainly livable with a decent incentive bonus, albeit with shaky criteria. Unfortunately, the culture of upper management can be thankless and borderline toxic at times. You will find yourself pursuing unattainable store perfection at all times, with no credit given."
King Soopers,1d5kj4jno1bge000,3.0,"I enjoyed creating boquets, and helping customers, but never made any advancement and had to continue with my schooling. They would not budge with scheduling."
King Soopers,1d5h6h2cd1bge000,4.0,"Good money for the work environment. Would recommend for this reason. Full time commitment and living wage, health BENEFITS. Other than that, it is what it is, a grocery store."
King Soopers,1d5g40klq1ahu000,3.0,"This job is fantastic for getting on your feet and to get yourself moving in a good direction.  They give discounts on Kroger products only.  They say they are extrelmely flexible with peoples schedules but if you even mention requesting a day off they will get up in arms about it.  Managment is friendly overall but some do a poor job ""managing.""  they can often times pick favorites as well."
King Soopers,1d5di1ojmak4h800,4.0,This company is great for anyone looking for a first job. This helped me develop better customer service and people skills which is crucial for any job.
King Soopers,1d593pqf21bge000,3.0,"The job itself was not that fun but coworkers were enjoyable to be around. Working in the deli the pay was not great and often felt like it did not match the amount of work put in, especially when running a shorthanded department."
King Soopers,1d55d6idv1bab000,3.0,Department hours are not spread out according to which department needs it the most. Its extremely stressful because almost every department is understaffed. The people who are in the department are expected to pick up the same amount of work as if they had been fully staffed. Everyone is very overworked.
King Soopers,1d4t51o831agi000,2.0,"The company has been around for a long time. But that doesn't mean they know how to take care of their employees. Management at my store has always been ok. Nothing more, nothing less. The pay is pretty terrible and you have to deal with every type of person. And Our Union has been absolutely terrible. In the several months they have had to do their job they have nothing to prove. The best part of the job is going to be the co-workers you will have. You will like some of them and you will hate some of them. This job is okay looking on paper but in practice its pretty terrible. Its just like communism."
King Soopers,1d4r3bil11bg2000,2.0,"Due to the fast-paced nature of the grocery business, I found my experience with King Soopers to be enjoyable . The only thing that I did not enjoy was being on my feet for several hours for a day."
King Soopers,1d4nod35f1bg2000,1.0,This game super I work that suck so badd that I wouldn't recommend it to my worst enemy get Your girl gone 150 characters The mama and her sisters Don't work  Here
King Soopers,1d4mkhbs6b80u800,5.0,the most enjoyable parts of the job was getting to interact with the customers and always engaging in customers need and getting to assist them with finding things.
King Soopers,1d4mepmdaaqgu800,5.0,I liked how people were concerned and were so understanding bout a lot of things. They actually listened to their employees. They always made sure that they were doing their job right
King Soopers,1d4mcceagakh4800,1.0,"Needs new management. Under payment is just an understatement: I've been underpaid many times for clocking in a minute early/late from lunch, it's very stressful, rude coworkers/customers. You must work there a year before you receive any kind of benefits, holiday pay is twenty cents more an hour (I made a dollar extra on my paycheck for working on thanksgiving.) Overall, was the least professional company I've ever worked for."
King Soopers,1d4ld8l12ak96800,5.0,If you dont work for kingsoopers when you get a chance your crazy. Its union based job and they pay weekly. I would love to go back to my old contract if I could get hired back
King Soopers,1d4jog36sak55800,3.0,Most coworkers were good to work with but the upper management has no idea the ins and outs of what the employees on the floor do. They come down and try to tell everyone to change what they are doing but have no idea the actual work being done because they don't see it happening.
King Soopers,1d4hkst58aqgr800,3.0,Good pay and benefits in union stores. Downfall is overload of work 10 hours of work in an 8 hour period. Management isn’t always the greatest and no one has your back
King Soopers,1d4dtf4mmak93800,3.0,"The pay is worth it, I worked with some really good people. Some really good benefits and the   hours are nice."
King Soopers,1d4bqaibbaqgr800,5.0,I didn't want to leave but had to due to red flags on my background check. The people were fun and always inviting along with hard working. I actually miss this job!!
King Soopers,1elgoaakcu2j4800,4.0,"I had very good relationship with managers, they were responsive, accommodating, and supportive. The over all environment was not the best, but it was a great temporary job."
King Soopers,1d47cb6asak93800,5.0,working with the company is great place to work and great opportunities and great management also workers are great too.i have other places I work with is not the same as working with king soopers not like their benefit and pay.
King Soopers,1d45pua3bak52800,5.0,"Very busy, sometimes you worked alone. I learned how do western union transactions, money order machine and, bill paying. Management was great, always helpful very appreciative. The hardest thing was difficult customers. I enjoyed meeting new people, enjoyed my co-workres."
King Soopers,1d41grll9ak8m800,3.0,reasonable workplace with flexible hours to acommodate a decent work/life balance. Union vs. company issues cause a rift between management and associate. Decent pay at upper levels.
King Soopers,1d4153t88ak8m800,4.0,"A typical day of work includes managing up to 25 employees breaks and lunches, picking up/loaning money, doing paperwork, and providing quality customer service. In management you are required to lead your team, and provide knowledge to customers on products as well as company policy."
King Soopers,1d4136nfvak8m800,3.0,I typical day of work is doing your job and another persons job as well.
King Soopers,1d3v70vm1ak8m800,4.0,Great company to work for with lots of room with advancement. Fast paced environment. Scheduling can be a little inconsistent. But gets better as you gain seniority
King Soopers,1d3qdiif5ak8m800,3.0,"It always depends on which store you are working at. Some are full of very friendly people and personable managers. There are raises and oppurtunities for advancement. Pay tops out at a certain point, though it takes years to reach it.. For my area, the maximum pay for employees on the floor or managers is okay. After a raise it could pay for living wages. Definitely a great job oppurtunity for students"
King Soopers,1d3mgi6foak4l800,3.0,"Managers do half the work of the cashiers and baggers and most are not very understanding. I did like the store owner at my location and the fast paced environment makes the job enjoyable. It's what you make of it, I personally love talking to customers (no, I'm not joking)"
King Soopers,1d3iaigg5ak8i800,4.0,Lack of career advancement opportunities even though I was highly qualified. applied for 2 advancement opportunities and I was denied for both. promotion given unfairly
King Soopers,1d3hh35611baf000,3.0,Everyone gets treated with respect
King Soopers,1d3fbea7e1d0t000,3.0,"It's rare to find a good manager, co-worker, or employee here. When said person is found most leave so very few even move up. Favoritism is a big issue here, some have been denied promotions over other's because of favoritism"
King Soopers,1d3cvnhjpakgg800,3.0,"Not real flexible,Pay is pretty good,long hours,not a lot of week ends off,good benefits,I learned how to use a cash register,customer service,difficult customers."
King Soopers,1d3cr2g14as0h800,3.0,was denied vacation even when requesting 5 months in advance.
King Soopers,1d3an189gak4h800,3.0,"A living nightmare, in short- everyone was selfish, and unwilling to help you (including management); I should have quit a lot sooner than I did. Sorry not sorry."
King Soopers,1d3829g6b1baf001,3.0,Worked most of my career in management and cant move up past department head due to the fact they choose who they like best rather then who is more qualified for the job.
King Soopers,1d34msqidak8i800,3.0,"I would clock in and check the schedule. I learned how to properly bag groceries, stocking shelves, maintenance, gathering carts, exchange propane tanks, how the dairy department worked. I seemed to do ok with management. A good mix of all age groups working together. Trying to advanced and not being allowed to. Meeting people and learning new things."
King Soopers,1d302qqn61d0n000,4.0,Friendly people always smiling. Everyone worked together to make customers experience fast and efficient. I learned how to properly bag like items together
King Soopers,1d2u5q31r0mtp000,4.0,Management was supportive. Coworker was sometime drama out but other then that very friendly and helpful. No one lets you struggle if you need help mostly anyone can help you in the store that works there.
King Soopers,1d2qrcsst1ai7000,5.0,King Soopers has many opportunities for growth if you show you are willing to work. The probationary period is very strict so if you mess up in your first month you can almost guarantee you'll lose your job.
King Soopers,1d2jtk49t1ba6000,2.0,The environment is fast paced which is a nice thing. But a lot of the time we are short staffed and cant keep up with the fast pace environment. Management is new so there is a lot of issues within management and the basic knowledge of the managers. While working at King Soopers for two years I did not have any raises or really any growth within the company.
King Soopers,1elgoaakcu2j4800,4.0,"I had very good relationship with managers, they were responsive, accommodating, and supportive. The over all environment was not the best, but it was a great temporary job."
King Soopers,1d2hbjkbq1ahm000,1.0,I ended up being fired because my manager had a problem with things going on in my life outside of work. She pulled some strings while I was in my 60 day probationary period and I ended up being terminated. I would not recommend this job to anyone. Period.
King Soopers,1d2gseq2a1ah6000,1.0,"I did not enjoy working at King Supers.  The pay was terrible.  Scheduling was horrible.  Often times my schedule would be changed and they wouldn't inform me, then write me up for not showing up."
King Soopers,1d2gg7n3s1bg6000,3.0,Overall environment gets a B-.
King Soopers,1d2g1avhg1ahl000,4.0,"I don't remember much of my time at king Sooper's, but i do remember is that i loved my cowokers. and loved being around people. also that i had friends there."
King Soopers,1d2b5vcphb89r801,5.0,my time at king soopers I was a courtesy clerk and we were always very busy but it was never that stressful because there were always enough people to take care of it
King Soopers,1d2avkbo4aqhf800,2.0,I did not get to work there for very long as they had hired to many people for the jobs available. There was not very much room for growth in the industry and not many people enjoyed their job.
King Soopers,1d2ahd4cdb860800,1.0,Don't care for their employees! Employees are like family. Healthcare is good. Don't get to close to any one keep to your self. Don't do anything out of your way because you don't get paid to do extra at this job.
King Soopers,1d287mljlaqhc800,1.0,five years they dont vaule their employess it is a hard place to work at when theres alot of call offs long term it can be good money five years down the line for new employees enless you become a manger than sooner
King Soopers,1d2606qkcb85t800,4.0,"If you love to talk to people all day, a cashier job is the job for you. I enjoyed the hours which were pretty regular and I enjoyed the talkative customers who made life easy."
King Soopers,1d22q5o4aak9i800,4.0,you get a paycheck every Thursday. you get to meet new people every day. learn new things every day. get a 10 percent discount of certain products and food. but the hardest part is multi tasking when bosses tell you to do certain things at certain times. and other people are just standing around not doing their own part of teamwork of the typical business day. mostly have to work on weekends and different shifts if you don't have seniority
King Soopers,1d1ugo9jobrdk800,1.0,A typical night we unloaded and stocked and conditioned shelves. Learned how to organize. The management was ok but the job culture was not good. We never had enough help and yet we were expected it to be done by a time too early so consequently we always had to work overtime. The most enjoyable part was getting to know my team members
King Soopers,1d1ma49ldak96800,1.0,They play favorites and promise promotions only if you do something for them. Store managers and assistant store managers don’t talk to employees unless approached by employee. Some head clerks don’t know what they are doing or how to act after they get promoted they are lazy. We don’t get paid what we are worth. Biggest thing in this company is it’s not what you know it’s who you know. Good job security because of the union. The only reason I haven’t left is because of the union local 7 UFCW. This could be a good place to work if managers and company actually cared about they’re employees. Don’t know if this is every store or just mine.
King Soopers,1d1k94o1saqh1801,4.0,"Although in my department myself and the rest of the team did our work in a timely manner and where very productive and had so many customer compliments, there just wasn't good leadership or direction from managers throughout the entire store all leading up to the store manager. But i really did enjoy working there."
King Soopers,1d1hf1bkpak96800,4.0,"The typical day is usually pretty busy, lots of customers, always a chance to talk to and meet new people. I have learned how to talk to people and make good impressions. The most enjoyable part of the day is talking to the customers."
King Soopers,1d1hcgmn5as17800,4.0,"The grocery market is complex, competitive, and highly unstable. American Retail customers are among the most difficult people one could meet, and Kroger's product policies enable further belligerent behavior, but I do understand why such strong steps were taken to advance customer service and CRM relations."
King Soopers,1d1ctdmu0aqh1800,5.0,"I was a cashier at king soopers for 7 to 8 years, I loved my job and had regular customers come to my line on a regular basis that became my friends. I am available for rehire if I wanted to"
King Soopers,1d19t9mlgb89g800,4.0,I got in as just a Clerk and could have easily kept moving up. The pay for management is very worth it. Great benefits. Lots of training and classes. Great Culture.
King Soopers,1d19i41fsakh0800,4.0,"King soopers is a good place to work, but the union can be a huge detriment to being able to work there for long. The union demands that employees are given hours based off how long they have been with thecompany, so a useless employee with 10 years of uselessness will get more hours than the new guy who works hard."
King Soopers,1d17kmnreb81f800,1.0,When I first started it was great but over the years it became a favorites game and began to not care about their employees. You must play the game and be a favorite and play foosball
King Soopers,1d1786k9mb89b800,2.0,No proper training then blame you for it.
